{
  "$schema": "https://json-schema.org/draft/2020-12/schema",
  "$id": "https://8bspec.local/schema/profile-v1.schema.json",
  "title": "8BitDo Pro 3 Profile v1",
  "type": "object",
  "additionalProperties": false,
  "required": [
    "id",
    "name",
    "version",
    "kind",
    "device",
    "mode",
    "sticks",
    "triggers",
    "vibration",
    "button_mappings",
    "macro_refs"
  ],
  "properties": {
    "id": {
      "type": "string",
      "minLength": 1,
      "maxLength": 64,
      "pattern": "^[a-z0-9][a-z0-9._-]*$"
    },
    "name": {
      "type": "string",
      "minLength": 1,
      "maxLength": 16
    },
    "version": {
      "type": "integer",
      "const": 1
    },
    "kind": {
      "type": "string",
      "const": "8bitdo.pro3.profile"
    },
    "device": {
      "type": "string",
      "const": "8bitdo-pro3"
    },
    "mode": {
      "type": "string",
      "enum": [
        "xinput",
        "switch",
        "dinput"
      ]
    },
    "preferred_slot": {
      "type": "integer",
      "minimum": 1,
      "maximum": 3
    },
    "sticks": {
      "$ref": "#/$defs/Sticks"
    },
    "triggers": {
      "type": "object"
    },
    "vibration": {
      "$ref": "#/$defs/Vibration"
    },
    "button_mappings": {
      "type": "array",
      "maxItems": 22
    },
    "macro_refs": {
      "type": "array",
      "maxItems": 4,
      "items": {
        "$ref": "#/$defs/MacroRef"
      }
    }
  },
  "$defs": {
    "ControlName": {
      "type": "string",
      "enum": [
        "right face",
        "bottom face",
        "top face",
        "left face",
        "l1",
        "r1",
        "l2",
        "r2",
        "l3",
        "r3",
        "select/back",
        "start/menu",
        "turbo",
        "home/guide",
        "d-pad up",
        "d-pad down",
        "d-pad left",
        "d-pad right",
        "rp",
        "lp",
        "l4",
        "r4"
      ]
    },
    "MacroTrigger": {
      "type": "string",
      "enum": [
        "right face",
        "bottom face",
        "top face",
        "left face",
        "l1",
        "r1",
        "l2",
        "r2",
        "l3",
        "r3",
        "select/back",
        "start/menu",
        "turbo",
        "d-pad up",
        "d-pad down",
        "d-pad left",
        "d-pad right",
        "rp",
        "lp",
        "l4",
        "r4"
      ]
    },
    "RelativePath": {
      "type": "string",
      "minLength": 1,
      "pattern": "^(?!/)(?![A-Za-z]:[\\\\/]).+$"
    },
    "TargetControlName": {
      "type": "string",
      "enum": [
        "right face",
        "bottom face",
        "top face",
        "left face",
        "l1",
        "r1",
        "l2",
        "r2",
        "l3",
        "r3",
        "select/back",
        "start/menu",
        "turbo",
        "home/guide",
        "d-pad up",
        "d-pad down",
        "d-pad left",
        "d-pad right"
      ]
    },
    "ButtonTarget": {
      "oneOf": [
        { "$ref": "#/$defs/TargetControlName" },
        { "type": "string", "const": "disabled" },
        { "type": "string", "const": "unrecognised", "description": "Read-only: the entry matches no known output. A write keeps its bytes as read." }
      ]
    },
    "ButtonTargetSwitch": {
      "oneOf": [
        { "$ref": "#/$defs/TargetControlName" },
        { "type": "string", "const": "disabled" },
        { "type": "string", "const": "unrecognised", "description": "Read-only: the entry matches no known output. A write keeps its bytes as read." },
        { "type": "string", "const": "screenshot" }
      ]
    },
    "ButtonTargetDInput": {
      "oneOf": [
        { "$ref": "#/$defs/TargetControlName" },
        { "type": "string", "const": "disabled" },
        { "type": "string", "const": "unrecognised", "description": "Read-only: the entry matches no known output. A write keeps its bytes as read." },
        { "type": "string", "enum": ["rp output", "lp output", "l4 output", "r4 output"], "description": "The code of a back paddle. Only DInput has an output for it." }
      ]
    },
    "ButtonMapping": {
      "type": "object",
      "additionalProperties": false,
      "required": [
        "source",
        "target"
      ],
      "properties": {
        "source": {
          "$ref": "#/$defs/ControlName"
        },
        "target": {
          "$ref": "#/$defs/ButtonTarget"
        }
      }
    },
    "ButtonMappingSwitch": {
      "type": "object",
      "additionalProperties": false,
      "required": [
        "source",
        "target"
      ],
      "properties": {
        "source": {
          "$ref": "#/$defs/ControlName"
        },
        "target": {
          "$ref": "#/$defs/ButtonTargetSwitch"
        }
      }
    },
    "ButtonMappingDInput": {
      "type": "object",
      "additionalProperties": false,
      "required": [
        "source",
        "target"
      ],
      "properties": {
        "source": {
          "$ref": "#/$defs/ControlName"
        },
        "target": {
          "$ref": "#/$defs/ButtonTargetDInput"
        }
      }
    },
    "Sticks": {
      "type": "object",
      "additionalProperties": false,
      "required": [
        "left_min_pct",
        "left_max_pct",
        "right_min_pct",
        "right_max_pct",
        "invert_left_x",
        "invert_left_y",
        "invert_right_x",
        "invert_right_y",
        "swap_sticks",
        "swap_dpad_with_left_stick"
      ],
      "properties": {
        "left_min_pct": {
          "type": "integer",
          "minimum": 0,
          "maximum": 90
        },
        "left_max_pct": {
          "type": "integer",
          "minimum": 10,
          "maximum": 100
        },
        "right_min_pct": {
          "type": "integer",
          "minimum": 0,
          "maximum": 90
        },
        "right_max_pct": {
          "type": "integer",
          "minimum": 10,
          "maximum": 100
        },
        "invert_left_x": {
          "type": "boolean"
        },
        "invert_left_y": {
          "type": "boolean"
        },
        "invert_right_x": {
          "type": "boolean"
        },
        "invert_right_y": {
          "type": "boolean"
        },
        "swap_sticks": {
          "type": "boolean"
        },
        "swap_dpad_with_left_stick": {
          "type": "boolean"
        }
      }
    },
    "Vibration": {
      "type": "object",
      "additionalProperties": false,
      "required": [
        "left_level",
        "right_level"
      ],
      "properties": {
        "left_level": {
          "type": "integer",
          "minimum": 0,
          "maximum": 5
        },
        "right_level": {
          "type": "integer",
          "minimum": 0,
          "maximum": 5
        }
      }
    },
    "TriggersAnalog": {
      "type": "object",
      "additionalProperties": false,
      "required": [
        "left_min_pct",
        "left_max_pct",
        "right_min_pct",
        "right_max_pct",
        "swap_triggers"
      ],
      "properties": {
        "left_min_pct": {
          "type": "integer",
          "minimum": 0,
          "maximum": 100
        },
        "left_max_pct": {
          "type": "integer",
          "minimum": 0,
          "maximum": 100
        },
        "right_min_pct": {
          "type": "integer",
          "minimum": 0,
          "maximum": 100
        },
        "right_max_pct": {
          "type": "integer",
          "minimum": 0,
          "maximum": 100
        },
        "swap_triggers": {
          "type": "boolean"
        }
      }
    },
    "TriggersSwitch": {
      "type": "object",
      "additionalProperties": false,
      "required": [
        "left_threshold_pct",
        "right_threshold_pct",
        "swap_triggers"
      ],
      "properties": {
        "left_threshold_pct": {
          "type": "integer",
          "minimum": 0,
          "maximum": 90
        },
        "right_threshold_pct": {
          "type": "integer",
          "minimum": 0,
          "maximum": 90
        },
        "swap_triggers": {
          "type": "boolean"
        }
      }
    },
    "MacroRef": {
      "type": "object",
      "additionalProperties": false,
      "required": [
        "path"
      ],
      "oneOf": [
        { "required": ["trigger_buttons"] },
        { "required": ["trigger"] }
      ],
      "properties": {
        "trigger_buttons": {
          "description": "The buttons that start the macro. Empty when no button starts it.",
          "type": "array",
          "uniqueItems": true,
          "items": {
            "$ref": "#/$defs/MacroTrigger"
          }
        },
        "trigger": {
          "description": "The single trigger button of a v0.1.1 profile. Read as a one-button trigger_buttons; never written.",
          "$ref": "#/$defs/MacroTrigger"
        },
        "path": {
          "$ref": "#/$defs/RelativePath"
        }
      }
    }
  },
  "allOf": [
    {
      "if": {
        "properties": {
          "mode": {
            "const": "switch"
          }
        }
      },
      "then": {
        "properties": {
          "triggers": {
            "$ref": "#/$defs/TriggersSwitch"
          },
          "button_mappings": {
            "type": "array",
            "maxItems": 22,
            "items": {
              "$ref": "#/$defs/ButtonMappingSwitch"
            }
          }
        }
      },
      "else": {
        "properties": {
          "triggers": {
            "$ref": "#/$defs/TriggersAnalog"
          },
          "button_mappings": {
            "type": "array",
            "maxItems": 22
          }
        },
        "if": {
          "properties": {
            "mode": {
              "const": "dinput"
            }
          }
        },
        "then": {
          "properties": {
            "button_mappings": {
              "items": {
                "$ref": "#/$defs/ButtonMappingDInput"
              }
            }
          }
        },
        "else": {
          "properties": {
            "button_mappings": {
              "items": {
                "$ref": "#/$defs/ButtonMapping"
              }
            }
          }
        }
      }
    }
  ],
  "description": "Schema-level constraints: rp/lp/l4/r4 are valid source buttons only (not targets); 'screenshot' is a valid target only for switch mode, and 'rp output', 'lp output', 'l4 output' and 'r4 output' only for dinput mode. Semantic validator requirements not expressible in core JSON Schema: no button in the trigger_buttons of two macro_refs, and profile/macro file existence checks. The semantic validator also refuses swap_dpad_with_left_stick together with swap_sticks, invert_left_x or invert_left_y, so its message can name the flags. Note: analog trigger min/max ordering and gap constraints are UI-only (slider limits) — the firmware accepts any values and the decoder auto-fixes inverted ranges."
}
